chambres,prix,source,surface,titre,type_bien,type_transaction,ville
3,310000.0,mubawab,150.0,Apartment to purchase in Monastir Ville. 3 rooms. Well furnished,Appart,À Vendre,Monastir
3,621626.0,mubawab,150.0,"Fabulous apartment for sale in El Kantaoui. 4 rooms. Caretaker service available, beautiful Swimming pool",Appart,À Vendre,Hammam Sousse
3,605561.0,mubawab,148.0,"Apartment for sale in El Kantaoui. Area of 148 m². Caretaker available, Large swimming pool",Appart,À Vendre,Hammam Sousse
2,620152.0,mubawab,132.0,Apartment for sale in El Kantaoui. 2 rooms. Lift and terrace,Appart,À Vendre,Hammam Sousse
6,2700000.0,mubawab,476.0,"Luxury home for sale in Cité Ennasr 1.10 large rooms. Usable fireplace, General air conditioning",House,À Vendre,Ariana
2,365000.0,mubawab,105.0,Apartment for sale in Hammamet Sud. 1 Room. Fully furnished,Appart,À Vendre,Hammamet
2,563644.0,mubawab,135.0,Beautiful apartment for sale in El Kantaoui. Total area 135 m². Air conditioning system,Appart,À Vendre,Hammam Sousse
2,514701.0,mubawab,115.0,"Beautiful apartment for sale in El Kantaoui. 3 comfortable rooms. Caretaker available, Large swimming pool",Appart,À Vendre,Hammam Sousse
2,506961.0,mubawab,116.0,"Find an apartment to buy in El Kantaoui. 2 rooms. Partial sea view, Centralised air conditioning",Appart,À Vendre,Hammam Sousse
1,342775.0,mubawab,74.0,"Sale of a lovely apartment in El Kantaoui. 1 lovely room. Sea view, central heating",Appart,À Vendre,Hammam Sousse
2,415524.0,mubawab,107.0,Apartment to purchase in El Kantaoui. 2 lovely rooms. Swimming pool and caretaker service,Appart,À Vendre,Hammam Sousse
3,604877.0,mubawab,150.0,"Find an apartment to buy in El Kantaoui. 3 rooms. Residence with swimming pool, Air conditioning",Appart,À Vendre,Hammam Sousse
1,298230.0,mubawab,67.0,"Fabulous apartment for sale in El Kantaoui. 1 lovely room. Caretaker available, Large swimming pool",Appart,À Vendre,Hammam Sousse
2,426690.0,mubawab,112.0,Apartment for sale in El Kantaoui. 3 large living areas. Caretaker and swimming pool,Appart,À Vendre,Hammam Sousse
1,330810.0,mubawab,73.0,Find an apartment to buy in El Kantaoui. Area 73 m². Built in oven,Appart,À Vendre,Hammam Sousse
1,288000.0,mubawab,70.0,"Apartment for sale in La Soukra. 2 large living areas. Cellar, Large terrace",Appart,À Vendre,La Soukra
1,287000.0,mubawab,68.0,"Sale of a lovely apartment in La Soukra. Total area 63 m². Thermal insulation and soundproofing, Secured door",Appart,À Vendre,La Soukra
2,580000.0,mubawab,125.0,Beautiful apartment for sale in Cité Ennasr. 2 rooms. Beautiful terrace,Appart,À Vendre,Mnihla
2,309900.0,mubawab,96.0,"Apartment to purchase in Cité el Ghazela. 2 rooms. Secured door, Secured neighbourhood",Appart,À Vendre,Raoued
3,493000.0,mubawab,118.0,"Sell apartment in Chotrana 1.4 large rooms. Cellar, Large terrace",Appart,À Vendre,La Soukra
1,209000.0,mubawab,46.0,Apartment to purchase in Chotrana 1.1 room. Equipped kitchen,Appart,À Vendre,La Soukra
2,431000.0,mubawab,100.0,Apartment for sale in Chotrana 1.3 large rooms. Basement,Appart,À Vendre,La Soukra
2,476000.0,mubawab,109.0,Apartment for sale in Chotrana 1.2 lovely rooms. Fitted kitchen,Appart,À Vendre,La Soukra
2,486000.0,mubawab,128.0,"Find an apartment to buy in Chotrana 1. Surface area 128 m². Cellar, Large terrace",Appart,À Vendre,La Soukra
10,650000.0,mubawab,300.0,Sell apartment in Nouvelle Ariana. 10 comfortable rooms.,Appart,À Vendre,Ariana
3,340000.0,mubawab,157.0,Apartment to purchase. Small area 157 m². Parking spaces and terrace,Appart,À Vendre,Ariana
3,155000.0,mubawab,100.0,Beautiful apartment for sale in Borj Louzir. 3 lovely rooms. Ample storage space,Appart,À Vendre,La Soukra
3,490000.0,mubawab,179.0,Apartment for sale. 3 large rooms. Private car park,Appart,À Vendre,Ariana
2,450000.0,mubawab,338.0,House to buy in Ariana. 2 comfortable rooms. Terrace,House,À Vendre,Ariana
5,1800000.0,mubawab,751.0,House for sale. 5 large rooms,House,À Vendre,Ariana
3,800000.0,mubawab,500.0,"Luxury Villa for sale in Borj Louzir. Dimension 500 m². Cellar, Large terrace.",House,À Vendre,La Soukra
2,200000.0,mubawab,80.0,Sale of a lovely apartment in Nouvelle Medina. Small area 80 m². Lift and terrace,Appart,À Vendre,Nouvelle Medina
2,235000.0,mubawab,121.0,Beautiful apartment for sale in Denden. Area of 121 m². Lift and terrace,Appart,À Vendre,La Manouba
1,320000.0,mubawab,80.0,"Sell apartment in La Soukra. 2 comfortable rooms. Robust door, Residence with security",Appart,À Vendre,La Soukra
1,293000.0,mubawab,69.0,Sale of a lovely apartment in La Soukra. Area of 69 m². With garage and lift,Appart,À Vendre,La Soukra
1,309000.0,mubawab,78.0,"Beautiful apartment for sale in La Soukra. Area 79 m². Secured door, Secured neighbourhood",Appart,À Vendre,La Soukra
4,360000.0,mubawab,174.0,"Apartment for sale in Cité Taieb Mhiri. Area 174 m². With Lift, Balcony",Appart,À Vendre,La Marsa
5,2200000.0,mubawab,500.0,Luxury Villa for sale in El Menzah 5.6 large living areas. Double glazing and central heating,House,À Vendre,Ariana
7,1150000.0,mubawab,450.0,"Luxury villa for sale in El Menzah 9.7 rooms. Carpark, Balcony",House,À Vendre,El Menzah
2,210000.0,mubawab,80.0,Apartment for sale. 2 rooms. View facing the sea,Appart,À Vendre,Hammam Ghezèze
3,145000.0,mubawab,64.0,Apartment for sale in Borj Cedria. Small area 64 m². Balcony,Appart,À Vendre,Hammam Chatt
3,300000.0,mubawab,170.0,Magnificent villa for sale in El Mourouj 3. Area 85 m²,House,À Vendre,El Mourouj
3,756000.0,mubawab,228.0,"Sale of a lovely apartment in Chotrana 1. Area 228 m². Green areas, Parking spaces for cars",Appart,À Vendre,La Soukra
2,576700.0,mubawab,166.0,Beautiful apartment for sale in Chotrana 1.3 rooms. Carpark and elevator,Appart,À Vendre,La Soukra
1,191000.0,mubawab,50.0,"Apartment to purchase in Chotrana 1. Area 50 m². Carpark, Balcony",Appart,À Vendre,La Soukra
2,300000.0,mubawab,127.0,Apartment to purchase in Ain Zaghouan. Dimension 127 m². Terrace and lift,Appart,À Vendre,La Marsa
2,285000.0,mubawab,83.0,Find an apartment to buy in Bhar Lazreg. Small area 83 m².,Appart,À Vendre,La Marsa
3,720000.0,mubawab,160.0,"Sale of a lovely apartment in Les Jardins de Carthage. Area 160 m². With Lift, Balcony.",Appart,À Vendre,Le Kram
2,576000.0,mubawab,118.0,Apartment for sale in Les Jardins de Carthage. 2 lovely rooms.,Appart,À Vendre,Le Kram
3,622000.0,mubawab,136.0,Apartment for sale in Les Jardins de Carthage. 3 lovely rooms.,Appart,À Vendre,Le Kram
1,316100.0,mubawab,104.0,Sale of a lovely apartment in Cité el Ghazela. 2 large living areas. Beautiful terrace and garden,Appart,À Vendre,Raoued
2,375200.0,mubawab,137.0,Find an apartment to buy in Cité el Ghazela. Area 137 m². Reinforced door and secured residence,Appart,À Vendre,Raoued
3,600000.0,mubawab,185.0,"Find an apartment to buy in Chotrana 1.3 rooms. Caretaker service available, General air conditioning",Appart,À Vendre,La Soukra
3,693494.0,mubawab,162.0,"Find an apartment to buy in Chotrana 3.3 rooms. Caretaker service available, air conditioning",Appart,À Vendre,La Soukra
1,2700000.0,mubawab,500.0,"Find your house to buy in Amilcar. Surface area 500 m². Large swimming pool, General air conditioning",House,À Vendre,Carthage
4,720000.0,mubawab,219.0,Find your house to buy in Cité El Wafa. Surface area 219 m². Property with swimming pool,House,À Vendre,Nabeul
4,560000.0,mubawab,270.0,High quality villa for sale in Hammamet. Area 270 m². Swimming pool,House,À Vendre,Hammamet
3,350000.0,mubawab,210.0,Sale of a lovely apartment in Nabeul. 3 rooms,Appart,À Vendre,Nabeul
1,145000.0,mubawab,101.0,"Beautiful house for sale in Cité Ennour Jaafar. 1 room. Green areas, Balcony",House,À Vendre,Raoued
3,750000.0,mubawab,230.0,Luxury Villa for sale in Hammamet. 3 lovely rooms. Garden and terrace,House,À Vendre,Hammamet
3,538000.0,mubawab,163.0,Find an apartment to buy in Cité el Ghazela. 3 beautiful rooms. Green areas and lift,Appart,À Vendre,Raoued
2,295000.0,mubawab,100.0,Home to buy in Sidi Hassine. 3 rooms. Garage and terrace,House,À Vendre,Sidi Hassine
2,235000.0,mubawab,107.0,Fabulous apartment for sale in Ain Zaghouan Sud. Surface area 107 m². Air conditioning system,Appart,À Vendre,La Marsa
3,285000.0,mubawab,116.0,Beautiful apartment for sale in La Soukra. 3 lovely rooms. Equipped kitchen,Appart,À Vendre,La Soukra
3,1300000.0,mubawab,440.0,House for sale in Sidi Bechir. 3 beautiful rooms. Equipped kitchen,House,À Vendre,Tunis
2,526000.0,mubawab,104.0,Fabulous apartment for sale in Sidi El Mahrsi. 3 rooms. Carpark and terrace,Appart,À Vendre,Nabeul
3,390000.0,mubawab,140.0,Sell apartment in El Menzah 1. Dimension 140 m². Reinforced door and central heating,Appart,À Vendre,El Menzah
4,395000.0,mubawab,150.0,"Sell apartment in El Manar 2.4 beautiful rooms. With Lift, Balcony",Appart,À Vendre,El Menzah
4,1250000.0,mubawab,260.0,Home to buy in La Soukra. 4 rooms. Garage and terrace,House,À Vendre,La Soukra
3,520000.0,mubawab,149.0,Beautiful apartment for sale in La Soukra. 3 beautiful rooms. Garage,Appart,À Vendre,La Soukra
2,650000.0,mubawab,105.0,Luxury Villa for sale in Les Berges Du Lac 2. Dimension 105 m². Well equipped kitchen.,House,À Vendre,La Marsa
3,1200000.0,mubawab,330.0,"Luxury Villa for sale in La Soukra. 5 comfortable rooms. Large swimming pool, General air conditioning.",House,À Vendre,La Soukra
3,580000.0,mubawab,139.0,Sale of a lovely apartment in Ain Zaghouan Nord. 3 rooms. Fully equipped kitchen,Appart,À Vendre,La Marsa
4,380000.0,mubawab,140.0,Apartment for sale in Dar Fadhal. Small area 140 m². Garage and terrace,Appart,À Vendre,La Soukra
3,1100000.0,mubawab,350.0,High quality house for sale in Hammamet Sud. Dimension 350 m². Furnishings,House,À Vendre,Hammamet
4,1050000.0,mubawab,280.0,Luxury home for sale in Hammamet. 4 large living areas. Swimming pool and air conditioning,House,À Vendre,Hammamet
4,1700000.0,mubawab,130.0,"Splendid villa for sale in Hammamet. Area 130 m². View facing the sea, central air conditioning.",House,À Vendre,Hammamet
3,230000.0,mubawab,1400.0,House for sale. 3 beautiful rooms. Carpark and garden.,House,À Vendre,Kélibia
3,655000.0,mubawab,470.0,House for sale in El Mourouj 6.4 large living areas. Beautiful terrace and garden,House,À Vendre,El Mourouj
3,320000.0,mubawab,150.0,"Fabulous villa for sale in Ben Arous. 3 beautiful rooms. Green areas, Balcony",House,À Vendre,Ben Arous
2,382000.0,mubawab,100.0,Find an apartment to buy in Cité El Wafa. Small area 100 m². Private garage,Appart,À Vendre,Nabeul
1,268000.0,mubawab,57.0,Apartment for sale in Hammamet. 1 Living area. Basement,Appart,À Vendre,Hammamet
3,690000.0,mubawab,385.0,House to buy in Hammamet. 3 lovely rooms. Balcony,House,À Vendre,Hammamet
2,390000.0,mubawab,132.0,Fabulous apartment for sale in Hammamet Nord. Surface area 132 m². Residence with security,Appart,À Vendre,Hammamet
2,630000.0,mubawab,90.0,Apartment for rent in La Goulette. Small area 85 m². Furnished,House,À Vendre,Carthage
2,230000.0,mubawab,100.0,"Fabulous apartment for sale. 2 lovely rooms. No Lift, Large terrace",Appart,À Vendre,Kélibia
2,645000.0,mubawab,219.0,Sell apartment. 2 beautiful rooms. Swimming pool and air conditioning,Appart,À Vendre,Bizerte
11,1200000.0,mubawab,560.0,Fabulous house for sale in Ben Arous. 11 lovely rooms. Parking spaces and garden,House,À Vendre,Ben Arous
16,2500000.0,mubawab,1700.0,House to buy in Mégrine. 16 lovely rooms. General air conditioning,House,À Vendre,Mégrine
5,1190000.0,mubawab,365.0,"Fabulous villa for sale. Area 365 m². Cellar, Large terrace.",House,À Vendre,Kélibia
5,860000.0,mubawab,500.0,"Fabulous house for sale. 5 lovely rooms. Residence with swimming pool, Air conditioning.",House,À Vendre,Kélibia
2,160000.0,mubawab,75.0,Fabulous apartment for sale. 2 rooms,Appart,À Vendre,Kélibia
3,220000.0,mubawab,170.0,Magnificent villa for sale. 5 rooms. Well equipped kitchen,House,À Vendre,Kélibia
2,230000.0,mubawab,106.0,Apartment to purchase. 2 rooms. Beautiful terrace,Appart,À Vendre,Kélibia
3,590000.0,mubawab,156.0,"Apartment for sale in Nabeul. Dimension 156 m². Green areas, Parking spaces for cars",Appart,À Vendre,Nabeul
3,250000.0,mubawab,200.0,Apartment for sale. 3 lovely rooms. Basement,Appart,À Vendre,Kélibia
4,3500000.0,mubawab,909.0,High quality villa for sale in Beni Khiar. Dimension 909 m².,House,À Vendre,Beni Khiar
8,1800000.0,mubawab,600.0,Beautiful house for sale. Dimension 600 m². Garage and terrace,House,À Vendre,Kélibia
2,400000.0,mubawab,240.0,Sale of a lovely apartment. 3 large living areas. Terrace and garden,Appart,À Vendre,Kélibia
2,277000.0,mubawab,96.0,Sale of a lovely apartment in Sousse Jaouhara. Small area 96 m²,Appart,À Vendre,Sousse Jaouhara
3,1238000.0,mubawab,188.0,Apartment to purchase in Les Jardins de Carthage. 3 lovely rooms. Reinforced door and secured residence,Appart,À Vendre,Le Kram
2,430000.0,mubawab,110.0,Find an apartment to buy in Chotrana 1.3 large rooms. Double glazed windows and central heating,Appart,À Vendre,La Soukra
2,199000.0,mubawab,75.0,Apartment to purchase. 3 large rooms. Security,Appart,À Vendre,Hammam El Ghezaz
2,230000.0,mubawab,103.0,Find an apartment to buy. 3 rooms. Well decorated.,Appart,À Vendre,Hammam El Ghezaz
1,165000.0,mubawab,55.0,Beautiful apartment for sale. 1 lovely room. Cellar.,Appart,À Vendre,Kélibia
3,1250000.0,mubawab,360.0,"Fabulous villa for sale in Hammamet Nord. 3 lovely rooms. Double glazed window, Central air conditioning.",House,À Vendre,Hammamet
3,149000.0,mubawab,826.0,Luxury home for sale. Surface area 826 m². Stunning view of the mountains.,House,À Vendre,El Haouaria
1,85000.0,mubawab,70.0,Fabulous apartment for sale. 1 room.,Appart,À Vendre,Hammam El Ghezaz
1,88000.0,mubawab,110.0,House for sale. Area of 110 m². Balcony,House,À Vendre,El Haouaria
5,480000.0,mubawab,280.0,"Fabulous house for sale. Dimension 280 m². Cellar, Large terrace",House,À Vendre,Kélibia
3,370000.0,mubawab,200.0,"Luxury Villa for sale. 3 beautiful rooms. Green areas, Parking spaces for cars",House,À Vendre,Kélibia
2,240000.0,mubawab,100.0,Apartment for sale. Area 100 m². Balcony,Appart,À Vendre,Hammam Ghezèze
2,864000.0,mubawab,149.0,"Sale of a lovely apartment in Les Jardins de Carthage. Total area 149 m². Secured door, Secured neighbourhood",Appart,À Vendre,Le Kram
3,472000.0,mubawab,132.0,Apartment for sale in Bhar Lazreg. 3 rooms.,Appart,À Vendre,La Marsa
1,420000.0,mubawab,75.0,Apartment to purchase in Les Jardins de Carthage. 1 lovely room. Garage.,Appart,À Vendre,Le Kram
4,980000.0,mubawab,275.0,Sale of a lovely apartment in Gammarth Village. 4 beautiful rooms. Garden and lift,Appart,À Vendre,La Marsa
2,582000.0,mubawab,176.0,Fabulous apartment for sale in Cité el Ghazela. 3 large rooms. Double glazing and central heating,Appart,À Vendre,Raoued
2,420000.0,mubawab,512.0,"Find your house to buy. 2 lovely rooms. Gardeners, Large terrace.",House,À Vendre,Kélibia
4,1500000.0,mubawab,680.0,"Fabulous villa for sale. 4 rooms. Carpark, Balcony",House,À Vendre,Kélibia
4,360000.0,mubawab,204.0,High quality house for sale. 4 lovely rooms. Garden and terrace,House,À Vendre,Kélibia
2,230000.0,mubawab,177.0,"High quality house for sale. 3 large rooms. Green areas, Balcony",House,À Vendre,Kélibia
2,260000.0,mubawab,77.0,Apartment for sale in Hammamet. 5 large living areas. Beautiful terrace,Appart,À Vendre,Hammamet
3,500000.0,mubawab,140.0,Luxury villa for sale. 3 rooms. Parking spaces and terrace,House,À Vendre,Menzel Temime
4,245000.0,mubawab,1331.0,"Home to buy. Total area 1331 m². Gardeners, Large terrace.",House,À Vendre,Hammam El Ghezaz
6,550000.0,mubawab,480.0,Sale of a lovely apartment. 6 rooms. New furniture.,Appart,À Vendre,Hammam El Ghezaz
1,120000.0,mubawab,50.0,Fabulous apartment for sale. 2 rooms. Beautiful terrace,Appart,À Vendre,Kélibia
2,190000.0,mubawab,60.0,Sell apartment. 2 rooms. Excellent sea view,Appart,À Vendre,El Haouaria
6,790000.0,mubawab,725.0,"Luxury Villa for sale in Kairouan Ville. 3 comfortable rooms. Double glazed window, Central air conditioning",House,À Vendre,Kairouan
2,160000.0,mubawab,79.0,"Apartment for sale in Kairouan Ville. Area of 79 m². Secured door, Secured neighbourhood",Appart,À Vendre,Kairouan
3,1400000.0,mubawab,750.0,Magnificent villa for sale. 3 lovely rooms. Double glazed windows and reinforced door,House,À Vendre,Kairouan Sud
3,433000.0,mubawab,150.0,Sell apartment in Ain Zaghouan Nord. Dimension 150 m². Garage and terrace,Appart,À Vendre,La Marsa
2,570000.0,mubawab,156.0,"Sell apartment in Les Jardins de Carthage. Large area 156 m². Cellar, Large terrace",Appart,À Vendre,Le Kram
2,680000.0,mubawab,131.0,"Apartment to purchase in Les Jardins de Carthage. Large area 131 m². General satellite dish system, On site security",Appart,À Vendre,Le Kram
1,209000.0,mubawab,83.0,"Sale of a lovely apartment in Aouina. Large area 83 m². Caretaker service, fireplace",Appart,À Vendre,La Marsa
4,2100000.0,mubawab,331.0,Luxury villa for sale in Gammarth. 6 large rooms. Carpark and garden,House,À Vendre,La Marsa
1,135000.0,mubawab,75.0,Apartment to purchase. Small area 75 m². Well decorated,Appart,À Vendre,Hammam Ghezèze
2,650000.0,mubawab,130.0,Magnificent villa for sale. 3 rooms. Private garden.,House,À Vendre,Kélibia
2,320000.0,mubawab,200.0,High quality house for sale. 2 rooms. Terrace and garden,House,À Vendre,Hammam El Ghezaz
3,210000.0,mubawab,145.0,Luxury home for sale. Large area 145 m². Carpark and terrace,House,À Vendre,Kélibia
3,330000.0,mubawab,300.0,Luxury Villa for sale. 3 rooms. Fully equipped kitchen,House,À Vendre,Kélibia
2,165000.0,mubawab,90.0,Sell apartment. 3 large living areas,Appart,À Vendre,Kélibia
2,240000.0,mubawab,216.0,Luxury home for sale. 3 rooms. Parking spaces and garden,House,À Vendre,Kélibia
5,530000.0,mubawab,230.0,Find your house to buy in La Soukra. 5 rooms. Double glazing and central heating,House,À Vendre,La Soukra
1,352410.0,mubawab,64.0,"Beautiful apartment for sale in Chotrana 1. Surface area 64 m². Double glazed window, Central air conditioning",Appart,À Vendre,La Soukra
2,148000.0,mubawab,90.0,Apartment for sale. Small area 90 m². Satellite dish system,Appart,À Vendre,Sousse Corniche
2,160000.0,mubawab,100.0,"Apartment for sale. Total area 100 m². Thermal insulation and soundproofing, Secured door",Appart,À Vendre,Sousse Corniche
2,569000.0,mubawab,125.0,Fabulous apartment for sale in Chotrana 1.2 beautiful rooms. Beautiful terrace and garden,Appart,À Vendre,La Soukra
2,412000.0,mubawab,103.0,"Apartment for sale in Cité Ennasr 2. Small area 103 m². Secured door, Secured neighbourhood",Appart,À Vendre,Ariana
3,650000.0,mubawab,170.0,"Apartment for sale in Cité Ennasr 2.3 rooms. Secured door, General satellite dish",Appart,À Vendre,Ariana
3,478000.0,mubawab,128.0,Fabulous apartment for sale in El Menzah 8.3 large living areas. Double glazing and central heating,Appart,À Vendre,Ariana
2,2500000.0,mubawab,1150.0,Apartment to purchase in République. 40 rooms,Appart,À Vendre,Tunis
2,280000.0,mubawab,88.0,Sell apartment in Route Teniour. Total area 88 m². Lift and terrace,Appart,À Vendre,Sfax
3,527000.0,mubawab,128.0,Sale of a lovely apartment in Cité Ennasr 2.3 large living areas. Double glazed windows and central heating,Appart,À Vendre,Ariana
1,220000.0,mubawab,47.0,Apartment to purchase in Cité Ennasr 2. Large area 47 m². Caretaker and air conditioning,Appart,À Vendre,Ariana
2,223000.0,mubawab,78.0,Fabulous apartment for sale. Large area 78 m². Fitted kitchen,Appart,À Vendre,Salakta
4,580000.0,mubawab,260.0,House for sale. 4 beautiful rooms,House,À Vendre,Hammam Ghezèze
1,334830.0,mubawab,62.0,"Apartment for sale in Chotrana 1.1 lovely room. Thermal insulation and soundproofing, Air conditioning installation",Appart,À Vendre,La Soukra
1,374730.0,mubawab,85.0,Sell apartment in Chotrana 1. Large area 85 m². Reinforced door and central heating,Appart,À Vendre,La Soukra
1,321900.0,mubawab,55.0,Apartment to purchase in Chotrana 1. Small area 55 m². Lift and parking spaces,Appart,À Vendre,La Soukra
1,341920.0,mubawab,63.0,Beautiful apartment for sale in Chotrana 1. Total area 63 m². Caretaker service and air conditioning,Appart,À Vendre,La Soukra
9,2700000.0,mubawab,400.0,Magnificent villa for sale. Area of 400 m². Beautiful terrace and garden,House,À Vendre,Kélibia
3,570000.0,mubawab,217.0,Apartment to purchase in La Marsa. Surface area 217 m². Parking spaces and beautiful garden,Appart,À Vendre,La Marsa
4,1200000.0,mubawab,305.0,High quality villa for sale in Ezzahra. 6 large living areas. Central heating,House,À Vendre,Ezzahra
1,252000.0,mubawab,58.0,Fabulous apartment for sale in La Soukra. 2 large rooms. Lift and parking,Appart,À Vendre,La Soukra
2,580000.0,mubawab,200.0,"High quality villa for sale in Houmt Souk. 3 rooms. Private garden, Cellar",House,À Vendre,Houmt Souk
2,370000.0,mubawab,86.0,Find an apartment to buy in Cité Ennasr 2.2 rooms. Double glazing and reinforced door,Appart,À Vendre,Ariana
3,630000.0,mubawab,168.0,"Apartment for rent in Les Berges Du Lac 2.1 Living area. With Lift, Carpark",Appart,À Vendre,La Marsa
3,1050000.0,mubawab,220.0,"Beautiful apartment for sale in Les Berges Du Lac 2. 3 lovely rooms. Exceptional sea view, central heating.",Appart,À Vendre,La Marsa
4,700000.0,mubawab,140.0,Find an apartment to buy in Les Berges Du Lac 2.4 rooms. Well furnished,Appart,À Vendre,La Marsa
2,1260000.0,mubawab,180.0,"Beautiful villa for rent in Les Jardins de Carthage. 2 comfortable rooms. Carpark, Balcony",House,À Vendre,Le Kram
3,642000.0,mubawab,160.0,"Sale of a lovely apartment. Surface area 160 m². Caretaker service available, air conditioning",Appart,À Vendre,Bizerte
4,850000.0,mubawab,473.0,Magnificent villa for sale in Montfleury. 6 lovely rooms. Beautiful terrace and garden,House,À Vendre,Tunis
2,1650000.0,mubawab,476.0,House for sale in Erriadh. 2 rooms. Basement,House,À Vendre,Le Kram
6,900000.0,mubawab,313.0,Magnificent villa for sale in Hammamet. 6 rooms. Gardeners,House,À Vendre,Hammamet
4,320000.0,mubawab,131.0,"Beautiful apartment for sale in El Manar 2. Area 131 m². General satellite dish system, On site security",Appart,À Vendre,El Menzah
2,380000.0,mubawab,160.0,"Sale of a lovely apartment in Aouina. Dimension 160 m². Green area, Balcony",Appart,À Vendre,La Marsa
3,450000.0,mubawab,135.0,Home to buy. 3 lovely rooms. Beautiful terrace and garden,House,À Vendre,Tezdaine
1,232000.0,mubawab,62.0,"Apartment to purchase in Ain Zaghouan. Surface area 62 m². Secured door, Enclosed residence",Appart,À Vendre,La Marsa
3,592500.0,mubawab,279.0,Apartment for sale in Neapolis. 3 beautiful rooms. Furnished,Appart,À Vendre,Nabeul
2,230000.0,mubawab,110.0,Home to buy. Total area 110 m². Garden and garage,House,À Vendre,Kélibia
6,470000.0,mubawab,170.0,Very nice house for sale. 6 large living areas. Basement,House,À Vendre,Kélibia
1,540000.0,mubawab,207.0,House to buy in Aouina. Dimension 207 m². Parking spaces and terrace,House,À Vendre,La Marsa
2,291292.0,mubawab,110.0,Apartment to purchase in Kairouan Ville. 2 beautiful rooms. Large balcony,Appart,À Vendre,Kairouan
6,1350000.0,mubawab,2967.0,Fabulous villa for sale. Small area 2967 m². Fully furnished.,House,À Vendre,Menzel Temime
2,450000.0,mubawab,145.0,Beautiful apartment for sale in Yasmine Hammamet. 2 lovely rooms. Reinforced door and central heating,Appart,À Vendre,Hammamet
2,420000.0,mubawab,100.0,Sell apartment in Yasmine Hammamet. Surface area 100 m². Attic.,Appart,À Vendre,Hammamet
2,375000.0,mubawab,140.0,"Beautiful apartment for sale in Ain Zaghouan Sud. 3 beautiful rooms. Cellar, Large terrace",Appart,À Vendre,La Marsa
2,295000.0,mubawab,109.0,Beautiful apartment for sale in Les Jardins dEl Menzah 2.3 large rooms. Fully equipped kitchen,Appart,À Vendre,Ariana
6,660000.0,mubawab,263.0,Luxury home for sale in El Omrane. 6 beautiful rooms. Garage and terrace,House,À Vendre,El Omrane
2,880000.0,mubawab,415.0,"Apartment to purchase in Gammarth. 3 rooms. Double glazed window, Central air conditioning",Appart,À Vendre,La Marsa
3,850000.0,mubawab,284.0,Luxury Villa for sale in Cité des Juges. 4 large rooms. Carpark and terrace,House,À Vendre,La Marsa
1,209000.0,mubawab,83.0,Find an apartment to buy in Aouina. 2 large rooms. Air conditioning,Appart,À Vendre,La Marsa
2,390000.0,mubawab,185.0,Apartment for sale in Aouina. Surface area 185 m². Carpark and terrace,Appart,À Vendre,La Marsa
2,224190.0,mubawab,95.0,Apartment to purchase in Kairouan Ville. Total area 95 m²,Appart,À Vendre,Kairouan
4,890000.0,mubawab,500.0,"High quality house for sale in Hammamet Nord. Surface area 500 m². Beautiful sea view, Double glazing",House,À Vendre,Hammamet
1,190000.0,mubawab,65.0,Fabulous apartment for sale in Ain Zaghouan Nord. 2 rooms. Fully furnished,Appart,À Vendre,La Marsa
2,330000.0,mubawab,90.0,Fabulous apartment for sale in Chotrana 3.2 rooms. Central heating and reinforced door,Appart,À Vendre,La Soukra
3,480000.0,mubawab,129.0,Apartment for sale in Bhar Lazreg. 3 rooms.,Appart,À Vendre,La Marsa
3,1300000.0,mubawab,200.0,Find an apartment to buy in Les Berges Du Lac 2.3 lovely rooms. Garden and garage,Appart,À Vendre,La Marsa
7,850000.0,mubawab,235.0,"Home to buy in Bhar Lazreg. Large area 235 m². Green area, Balcony",House,À Vendre,La Marsa
4,1100000.0,mubawab,530.0,Fabulous house for sale in Ariana. Surface area 530 m²,House,À Vendre,Ariana
3,257500.0,mubawab,100.0,House for sale in La Manouba. 4 large rooms. Air conditioning system,House,À Vendre,La Manouba
