chambres,prix,source,surface,titre,type_bien,type_transaction,ville
5,600000.0,mubawab,300.0,"Home to buy in Jaafar. 2 large rooms. Green area, Balcony",House,À Vendre,Raoued
3,380000.0,mubawab,158.0,Sale of a lovely apartment in Cité Ennasr 2.3 large rooms. Terrace and lift,Appart,À Vendre,Ariana
3,980000.0,mubawab,398.0,Luxury home for sale in Douz. 7 large rooms. Well furnished,House,À Vendre,Douz
3,420000.0,mubawab,112.0,Sale of a lovely apartment. 4 comfortable rooms. With garage and lift,Appart,À Vendre,Khezama Est
6,5500000.0,mubawab,4800.0,House to buy. Small area 4800 m². Well furnished,House,À Vendre,Akouda
2,470000.0,mubawab,120.0,Fabulous apartment for sale. 2 rooms. Fully furnished,Appart,À Vendre,Sousse Jaouhara
4,590000.0,mubawab,134.0,Sale of a lovely apartment. Area of 200 m². Lift and parking spaces,Appart,À Vendre,Khezama Est
2,250000.0,mubawab,103.0,Fabulous apartment for sale in El Mourouj 6.2 beautiful rooms. Lift and terrace,Appart,À Vendre,El Mourouj
2,445000.0,mubawab,107.0,Beautiful apartment for sale in Sousse Ville. 2 rooms. Satellite dish system and secured residence,Appart,À Vendre,Sousse
2,450000.0,mubawab,155.0,Beautiful apartment for sale in Sahloul. 2 beautiful rooms. Satellite dish and Reinforced door,Appart,À Vendre,Sahloul
6,700000.0,mubawab,324.0,"Very nice house for sale in Ben Arous. Dimension 324 m². Residence with swimming pool, Air conditioning",House,À Vendre,Ben Arous
1,260000.0,mubawab,63.0,"Fabulous apartment for sale in Sahloul. 2 large living areas. Robust door, Residence with security",Appart,À Vendre,Sahloul
2,170000.0,mubawab,64.0,Beautiful apartment for sale in Sahloul. Area 64 m². Furnished,Appart,À Vendre,Sahloul
3,750000.0,mubawab,228.0,Very nice house for sale in El Menzah 5.4 large rooms. Large terrace,House,À Vendre,Ariana
4,300000.0,mubawab,140.0,Apartment to purchase in Chatt Meriem. 6 large living areas. Balcony,Appart,À Vendre,Sousse
2,630000.0,mubawab,160.0,Apartment to purchase in Sahloul. 4 large rooms. Caretaker service and air conditioning,Appart,À Vendre,Sahloul
3,735000.0,mubawab,183.0,"Apartment for sale in Sahloul. Area 183 m². Reinforced door, security",Appart,À Vendre,Sahloul
3,365000.0,mubawab,150.0,"Apartment for sale in Cité Ennasr 2.3 rooms. No Lift, Large terrace",Appart,À Vendre,Ariana
3,384500.0,mubawab,150.0,"Apartment for sale in El Menzah 4.3 rooms. No Lift, Large terrace",Appart,À Vendre,El Menzah
2,250000.0,mubawab,120.0,"Find your house to buy. Dimension 120 m². View facing the sea, Secured door",House,À Vendre,El Mida
3,749900.0,mubawab,320.0,"Magnificent villa for sale in El Menzah 5.4 comfortable rooms. Green areas, Balcony",House,À Vendre,Ariana
3,690000.0,mubawab,131.0,Find an apartment to buy in Sidi Daoued. 2 lovely rooms. Storage unit,Appart,À Vendre,La Marsa
2,305000.0,mubawab,100.0,"Apartment for sale in Aouina. 3 comfortable rooms. Caretaker service available, General air conditioning",Appart,À Vendre,La Marsa
2,370000.0,mubawab,114.0,Apartment to purchase in Sahloul. 1 Room. Lift and terrace,Appart,À Vendre,Sahloul
3,360000.0,mubawab,130.0,Sale of a lovely apartment in Aouina. 4 rooms. Terrace and garden,Appart,À Vendre,La Marsa
1,249000.0,mubawab,81.0,Beautiful apartment for sale in Chotrana 1.2 rooms. Double glazing and central heating,Appart,À Vendre,La Soukra
1,290000.0,mubawab,70.0,"Apartment for sale in Hammamet Nord. 1 lovely room. Robust door, Air conditioning installation",Appart,À Vendre,Hammamet
4,540000.0,mubawab,232.0,"High quality villa for sale. 4 lovely rooms. Carpark, Balcony",House,À Vendre,Dar Châabane
3,320000.0,mubawab,130.0,Sell apartment in Dar Fadhal. 3 beautiful rooms. Parking spaces and terrace,Appart,À Vendre,La Soukra
7,1200000.0,mubawab,535.0,House for sale in Mornag. 7 comfortable rooms. Lift and garage,House,À Vendre,Mornag
4,1380000.0,mubawab,305.0,House for sale in La Soukra. 4 beautiful rooms. Parking spaces and terrace,House,À Vendre,La Soukra
3,345000.0,mubawab,137.0,Sale of a lovely apartment in Le Bardo. Large area 137 m². Central heating,Appart,À Vendre,Le Bardo
4,2800000.0,mubawab,1440.0,Find your house to buy in Ain Zaghouan Sud. Small area 1440 m². Air conditioning and fireplace,House,À Vendre,La Marsa
3,620000.0,mubawab,200.0,"Beautiful apartment for sale in La Marsa. Total area 200 m². Green area, Balcony",Appart,À Vendre,La Marsa
1,207000.0,mubawab,52.0,"Apartment for sale in Aouina. 1 lovely room. Robust door, Air conditioning installation",Appart,À Vendre,La Marsa
2,444000.0,mubawab,127.0,"Fabulous apartment for sale in Hammamet. 3 rooms. No Lift, Balcony.",Appart,À Vendre,Hammamet
5,650000.0,mubawab,250.0,"Find your house to buy in Hammamet. Total area 250 m². Carpark, Balcony",House,À Vendre,Hammamet
3,700000.0,mubawab,207.0,Fabulous house for sale in Djerba. 3 large living areas. Storage unit,House,À Vendre,Djerba
4,610000.0,mubawab,192.0,Beautiful house for sale in Salambo. Area of 192 m². Terrace,House,À Vendre,Carthage
3,175000.0,mubawab,98.0,Apartment for sale. 3 rooms. Air conditioning system,Appart,À Vendre,Ben Arous
1,250000.0,mubawab,65.0,"Beautiful apartment for sale in Hammamet Nord. 1 lovely room. Robust door, Air conditioning installation",Appart,À Vendre,Hammamet
3,950000000.0,mubawab,230.0,High quality villa for sale in Skanes. 3 lovely rooms. Reinforced door and central heating,House,À Vendre,Monastir
3,520000.0,mubawab,149.0,Apartment to purchase in Aouina. 4 large living areas. Car park,Appart,À Vendre,La Marsa
5,1500000.0,mubawab,1000.0,House for sale in Sousse Ville. Small area 1000 m²,House,À Vendre,Sousse
2,450000.0,mubawab,120.0,"Find an apartment to buy in Hammamet. Large area 120 m². Cellar, Large terrace",Appart,À Vendre,Hammamet
4,790000.0,mubawab,400.0,Luxury Villa for sale in Hammamet. Small area 400 m². Garden and garage,House,À Vendre,Hammamet
3,300000.0,mubawab,150.0,Sell apartment in Aouina. 3 beautiful rooms. Lift and parking,Appart,À Vendre,La Marsa
3,675000.0,mubawab,187.0,Home to buy in La Marsa. Small area 187 m². Carpark and terrace,House,À Vendre,La Marsa
2,165000.0,mubawab,90.0,Apartment to purchase in Hammam Sousse. 2 lovely rooms. Satellite dish and Reinforced door,Appart,À Vendre,Hammam Sousse
3,310000.0,mubawab,154.0,Beautiful apartment for sale in Aouina. 4 large living areas. Double glazed windows and central heating,Appart,À Vendre,La Marsa
2,290000000.0,mubawab,124.0,Apartment for sale in Ariana. 2 beautiful rooms. Satellite dish system and secured residence,Appart,À Vendre,Ariana
6,4250000.0,mubawab,910.0,Luxury home for sale in Gammarth. Dimension 910 m². Garden and garage,House,À Vendre,La Marsa
3,1305000.0,mubawab,275.0,"Apartment for sale in Les Jardins de Carthage. 3 lovely rooms. Gardeners, Large terrace",Appart,À Vendre,Le Kram
3,1250000.0,mubawab,349.0,House for sale in Hammamet. Small area 349 m². Fully furnished,House,À Vendre,Hammamet
3,1150000.0,mubawab,340.0,Fabulous house for sale in Hammamet. Small area 340 m². Equipped kitchen,House,À Vendre,Hammamet
1,270000.0,mubawab,69.0,"Apartment for sale in Hammamet. Dimension 69 m². Caretaker service available, air conditioning",Appart,À Vendre,Hammamet
3,450000.0,mubawab,600.0,House for sale in Hammamet. Area of 600 m²,House,À Vendre,Hammamet
3,2000000.0,mubawab,456.0,Luxury home for sale in Neapolis. 3 rooms. Green area,House,À Vendre,Nabeul
2,300000.0,mubawab,450.0,High quality villa for sale in Hammamet. 3 large rooms. New furniture,House,À Vendre,Hammamet
3,350000.0,mubawab,197.0,House for sale. 4 large rooms. Carpark and terrace,House,À Vendre,Hammam Sousse Ghrabi
7,2400000.0,mubawab,440.0,High quality villa for sale in Cité des Juges. 7 rooms. Reinforced door and double glazing,House,À Vendre,La Soukra
6,700000.0,mubawab,95.0,"Fabulous villa for sale in Cité Bou Mhel. 6 lovely rooms. Quiet sorroundings with mountain view, Secured door",House,À Vendre,Boumhel Bassatine
3,890000.0,mubawab,265.0,Magnificent villa for sale in Cité El Khalil. 3 lovely rooms. Swimming pool and air conditioning,House,À Vendre,La Marsa
2,200000.0,mubawab,80.0,Home to buy in Ain Zaghouan Sud. 1 Living area,House,À Vendre,La Marsa
3,485000.0,mubawab,225.0,House for sale in Gammarth. 1 Living area. Green area,House,À Vendre,La Marsa
5,2800000.0,mubawab,800.0,Luxury Villa for sale in Hammamet Nord. 1 Room. Furnishings,House,À Vendre,Hammamet
5,960000.0,mubawab,420.0,"Splendid villa for sale in Sahloul. 5 lovely rooms. Gardeners, Large terrace",House,À Vendre,Sahloul
1,206000.0,mubawab,56.0,Apartment for sale in Aouina. 1 lovely room. Green areas and lift,Appart,À Vendre,La Marsa
4,1700000.0,mubawab,308.0,Apartment for rent in Gammarth. 4 beautiful rooms. Double glazing and central heating,Appart,À Vendre,La Marsa
4,1700000.0,mubawab,629.0,"Very nice house for sale in El Menzah 6.6 large living areas. Green areas, Balcony",House,À Vendre,El Menzah
3,600000.0,mubawab,250.0,Beautiful house for sale. Surface area 250 m². Fully furnished,House,À Vendre,El Haouaria
3,680000.0,mubawab,234.0,Apartment for sale in El Menzah 8.5 rooms. Double glazed windows and central heating,Appart,À Vendre,El Menzah
3,370000.0,mubawab,130.0,"Home to buy in Houmt Souk. 4 comfortable rooms. Green area, Balcony",House,À Vendre,Houmt Souk
3,310000.0,mubawab,140.0,Apartment for sale in Hedi Chaker. Total area 140 m². Central heating,Appart,À Vendre,Tunis
2,409000.0,mubawab,112.0,Apartment for sale in Cité Ennasr 2.2 rooms. Terrace and lift,Appart,À Vendre,Ariana
2,325000.0,mubawab,77.0,House for sale in Sidi Bousaid. 2 beautiful rooms,House,À Vendre,Carthage
3,550000.0,mubawab,680.0,Beautiful house for sale in Midoune. 3 rooms. Parking spaces and terrace,House,À Vendre,Midoun
4,850000.0,mubawab,1400.0,"Fabulous villa for sale in Mornag. Area of 1400 m². Exceptional mountain view, Soundproofing",House,À Vendre,Mornag
2,190000.0,mubawab,90.0,House for sale in Raoued. 3 rooms. Well decorated,House,À Vendre,Raoued
1,390000.0,mubawab,106.0,Apartment for sale in Riadh al Andalous. 3 beautiful rooms. Fully equipped kitchen,Appart,À Vendre,Ariana
1,335000.0,mubawab,60.0,Beautiful apartment for sale in Les Jardins de Carthage. 1 lovely room. Double glazed windows and central heating,Appart,À Vendre,Le Kram
2,85000.0,mubawab,78.0,Sale of a lovely apartment in Sousse Riadh. Area 78 m². Garden and terrace,Appart,À Vendre,Sousse Riadh
3,133000.0,mubawab,114.0,Apartment for sale in Sousse Riadh. 4 large living areas. Reinforced door and secured residence,Appart,À Vendre,Sousse Riadh
2,880000.0,mubawab,415.0,"Sale of a lovely apartment in Gammarth. 2 rooms. Caretaker service available, General air conditioning",Appart,À Vendre,La Marsa
3,69000.0,mubawab,150.0,Apartment for sale. 4 comfortable rooms. Beautiful terrace,Appart,À Vendre,Kélibia
2,245000.0,mubawab,112.0,Sell apartment in Aouina. 2 lovely rooms. Terrace and lift,Appart,À Vendre,La Marsa
2,470000.0,mubawab,126.0,Fabulous apartment for sale in El Kantaoui. 2 lovely rooms. New furniture,Appart,À Vendre,Hammam Sousse
4,850000.0,mubawab,733.0,High quality villa for sale in Borj Louzir. 4 large rooms. Parking spaces and garden,House,À Vendre,La Soukra
3,320000.0,mubawab,160.0,Beautiful apartment for sale in Cité Ennkhilet. 3 beautiful rooms,Appart,À Vendre,Raoued
3,400000.0,mubawab,137.0,Find an apartment to buy in Ezzahra. 4 large living areas. Parking spaces and terrace,Appart,À Vendre,Ezzahra
4,6500.0,mubawab,1800.0,Fabulous house for sale in Chott Meriem. 4 beautiful rooms. New furniture,House,À Vendre,Akouda
2,370000.0,mubawab,130.0,"Apartment for sale in Cité Ennasr 2. Total area 130 m². Cellar, Large terrace",Appart,À Vendre,Ariana
4,1450000.0,mubawab,325.0,"Luxury Villa for sale in La Soukra. 5 large living areas. Caretaker available, Large swimming pool",House,À Vendre,La Soukra
2,340000.0,mubawab,116.0,Fabulous apartment for sale in Cité El Wafa. Large area 116 m². Car park,Appart,À Vendre,Nabeul
1,150000.0,mubawab,42.0,Apartment to purchase in Cité El Wafa. Total area 42 m². Secured neighbourhood,Appart,À Vendre,Nabeul
3,605000.0,mubawab,207.0,Fabulous house for sale in Cité El Wafa. 3 rooms,House,À Vendre,Nabeul
2,280000.0,mubawab,75.0,Beautiful apartment for sale in Chott Meriem. 1 Living area. Central heating,Appart,À Vendre,Akouda
1,280000.0,mubawab,62.0,Sale of a lovely apartment in Cité El Wafa. 1 room. Storage unit,Appart,À Vendre,Nabeul
1,245000.0,mubawab,70.0,Apartment for sale in Sahloul. 1 Living area. Air conditioning,Appart,À Vendre,Sahloul
1,210000.0,mubawab,55.0,"Apartment for sale in Bouhssina. 1 Living area. Caretaker service available, General air conditioning",Appart,À Vendre,Sousse
2,370000.0,mubawab,126.0,Sale of a lovely apartment in Sahloul. 1 Room. Lift and terrace,Appart,À Vendre,Sahloul
1,350000.0,mubawab,73.0,"Apartment to purchase in Chott Meriem. Surface area 73 m². Private garden, No Lift",Appart,À Vendre,Akouda
4,2000000.0,mubawab,680.0,House to buy in La Marsa. 4 beautiful rooms. Security,House,À Vendre,La Marsa
4,2150000.0,mubawab,460.0,"Home to buy in Gammarth. Area 460 m². Gardeners, Large terrace",House,À Vendre,La Marsa
3,422580.0,mubawab,192.0,"Luxury villa for sale in Djerba. 5 large rooms. Green area, Balcony.",House,À Vendre,Djerba
3,659200.0,mubawab,175.0,Fabulous villa for sale in Djerba. 3 beautiful rooms. Well decorated,House,À Vendre,Djerba
5,1950000.0,mubawab,747.0,Very nice house for sale in Cité El Wafa. 5 lovely rooms. Air conditioning and swimming pool.,House,À Vendre,Nabeul
4,2300000.0,mubawab,2400.0,Very nice house for sale in Hammamet. 4 large rooms. Parking spaces and garden,House,À Vendre,Hammamet
4,440000.0,mubawab,400.0,"House to buy. Small area 400 m². Green areas, Parking spaces for cars",House,À Vendre,Barraket Essahel
1,310000.0,mubawab,54.0,Rent this apartment in Les Jardins de Carthage. 2 large living areas. Terrace and lift,Appart,À Vendre,Le Kram
2,543000.0,mubawab,92.0,Apartment for sale in Les Jardins de Carthage. Area 92 m². With lift and terrace,Appart,À Vendre,Le Kram
3,766000.0,mubawab,132.0,"Sell apartment in Les Jardins de Carthage. 4 large living areas. Carpark, Balcony",Appart,À Vendre,Le Kram
1,373000.0,mubawab,65.0,Sell apartment in Les Jardins de Carthage. 2 rooms. Caretaker and air conditioning,Appart,À Vendre,Le Kram
1,370000.0,mubawab,74.0,Find an apartment to buy in Ain Zaghouan Nord. 1 lovely room. Satellite dish and Reinforced door,Appart,À Vendre,La Marsa
5,1500000.0,mubawab,373.0,Apartment for sale in Les Jardins de Carthage. 6 large living areas. Satellite dish and Reinforced door,Appart,À Vendre,Le Kram
3,760000.0,mubawab,138.0,Apartment to purchase in Les Jardins de Carthage. 4 rooms. Satellite dish system and secured residence,Appart,À Vendre,Le Kram
3,400000.0,mubawab,180.0,"Apartment for sale in Les Jardins dEl Menzah 2.4 large living areas. Caretaker service available, air conditioning",Appart,À Vendre,Ariana
6,650000.0,mubawab,610.0,Splendid villa for sale in Cité Ennkhilet. 3 beautiful rooms. Beautiful terrace and garden,House,À Vendre,Raoued
2,200000.0,mubawab,80.0,Fabulous apartment for sale. Surface area 80 m². Ample storage space,Appart,À Vendre,Tantana
2,200000.0,mubawab,80.0,Sale of a lovely apartment in Chatt Meriem. 2 beautiful rooms. Furnishings,Appart,À Vendre,Sousse
4,510000.0,mubawab,280.0,"Luxury home for sale in Rades Meliane. 4 rooms. Green area, Balcony",House,À Vendre,Rades
3,750000.0,mubawab,496.0,Sale of a lovely apartment in Megrine Coteau. Small area 100 m². Secured neighbourhood,Appart,À Vendre,Mégrine
4,310000.0,mubawab,434.0,Fabulous house for sale in Akouda. 4 beautiful rooms. Cellar,House,À Vendre,Akouda
4,450000.0,mubawab,170.0,Home to buy in Chatt Meriem. Large area 170 m². Stove,House,À Vendre,Sousse
2,125000.0,mubawab,85.0,Sale of a lovely apartment in Sousse Riadh. Total area 85 m². Air conditioning system,Appart,À Vendre,Sousse Riadh
3,380000.0,mubawab,208.0,High quality villa for sale in Cité Rafaha. 3 lovely rooms. Air conditioning system,House,À Vendre,Mnihla
5,2700000.0,mubawab,210.0,Find your house to buy. Surface area 210 m². Balcony,House,À Vendre,Carthage
9,2500000.0,mubawab,813.0,Beautiful house for sale in Gammarth Supérieur. 9 rooms. Beautiful terrace and garden,House,À Vendre,La Marsa
5,1800000.0,mubawab,612.0,Very nice house for sale. 5 lovely rooms. Garden and garage,House,À Vendre,Cité El Menzah
5,7000.0,mubawab,600.0,Find your house to buy in Gammarth Supérieur. 5 beautiful rooms. Parking spaces and beautiful garden,House,À Vendre,La Marsa
3,1200000.0,mubawab,200.0,Beautiful house for sale in La Marsa. Small area 200 m². New furniture,House,À Vendre,La Marsa
1,258400.0,mubawab,68.0,Find an apartment to buy in Cité El Wafa. Surface area 62 m². Cellar,Appart,À Vendre,Nabeul
2,150000.0,mubawab,92.0,Apartment for sale in Hammam Lif. Small area 92 m²,Appart,À Vendre,Hammam Lif
2,170000.0,mubawab,65.0,Find an apartment to buy. Small area 65 m²,Appart,À Vendre,Soliman
11,420000.0,mubawab,400.0,House for sale. Area 400 m². Parking spaces,House,À Vendre,Hammam Chatt
2,75000.0,mubawab,75.0,Fabulous apartment for sale in Bab Bhar. 3 rooms. Fully equipped kitchen,Appart,À Vendre,Tunis
5,1850000.0,mubawab,314.0,"High quality house for sale in Chotrana 2.6 large living areas. Secured door, Enclosed residence",House,À Vendre,La Soukra
3,300000.0,mubawab,450.0,Home to buy in Mornaguia. 4 rooms. Garden,House,À Vendre,Mornaguia
2,240000.0,mubawab,100.0,Sell apartment. 2 comfortable rooms. Exceptional sea view.,Appart,À Vendre,Hammam El Ghezaz
3,530000.0,mubawab,225.0,Fabulous house for sale in Raoued. 3 beautiful rooms. Double glazing and central heating,House,À Vendre,Raoued
8,1400000.0,mubawab,600.0,High quality house for sale. Large area 600 m². Garden,House,À Vendre,Ariana
3,600000.0,mubawab,200.0,Apartment for sale in Nabeul. 4 comfortable rooms. Parking spaces and terrace,Appart,À Vendre,Nabeul
5,730000.0,mubawab,313.0,High quality villa for sale in Nabeul. Dimension 313 m². Terrace and garden,House,À Vendre,Nabeul
4,500000.0,mubawab,195.0,"Beautiful apartment for sale in Nabeul. Dimension 195 m². Cellar, Large terrace",House,À Vendre,Nabeul
7,1500000.0,mubawab,500.0,"Fabulous house for sale in El Menzah 5. Surface area 500 m². Gardeners, Large terrace.",House,À Vendre,Ariana
3,750000.0,mubawab,220.0,Fabulous house for sale in Djerba. 5 rooms. Gardeners,House,À Vendre,Djerba
2,420000.0,mubawab,105.0,Apartment to purchase in Hammamet Sud. 2 large rooms. Dressing room,Appart,À Vendre,Hammamet
3,540000.0,mubawab,118.0,"Fabulous apartment for sale in Dar Fadhal. 3 lovely rooms. Robust door, On site security",Appart,À Vendre,La Soukra
7,860000.0,mubawab,500.0,High quality house for sale in Riadh al Andalous. 7 rooms. Terrace and garden,House,À Vendre,Ariana
7,790000.0,mubawab,501.0,Fabulous house for sale in El Ouardia. 11 rooms. Parking spaces and garden,House,À Vendre,El Ouardia
1,200000.0,mubawab,70.0,"Apartment for sale in Nabeul. Small area 70 m². Secured door, Central air conditioning",Appart,À Vendre,Beni Khiar
2,270000.0,mubawab,82.0,Sale of a lovely apartment in Beni Khiar. 3 large living areas. Central heating and reinforced door,Appart,À Vendre,Beni Khiar
6,835000.0,mubawab,810.0,House for sale in Chotrana 1.5 comfortable rooms. Garage and terrace,House,À Vendre,La Soukra
3,550000.0,mubawab,170.0,Find your house to buy in Hammamet. 5 large rooms. Air conditioning system,House,À Vendre,Hammamet
5,1800000.0,mubawab,223.0,Fabulous villa for sale in Les Jardins de Carthage. 4 large living areas. Parking spaces and beautiful garden,House,À Vendre,Le Kram
1,195000.0,mubawab,67.0,Apartment for sale in Bhar Lazreg. 1 lovely room. Parking spaces and terrace,Appart,À Vendre,La Marsa
1,267000.0,mubawab,67.0,Fabulous apartment for sale in Cité Jardins. 1 lovely room. Lift,Appart,À Vendre,Cité El Khadra
3,178000.0,mubawab,113.0,Beautiful apartment for sale in El Omrane. 3 beautiful rooms,Appart,À Vendre,Tunis
3,450000.0,mubawab,167.0,"Sell apartment in La Marsa. Surface area 167 m². With Lift, Carpark",Appart,À Vendre,La Marsa
3,690000.0,mubawab,200.0,House to buy in La Soukra. 4 large living areas. Closed residence,House,À Vendre,La Soukra
2,355000.0,mubawab,101.0,Sale of a lovely apartment in Chott Meriem. 2 comfortable rooms. Terrace and lift,Appart,À Vendre,Akouda
3,690000.0,mubawab,145.0,"House for sale in Sidi Frej. Large area 145 m². Green areas, Parking spaces for cars",House,À Vendre,La Soukra
3,487000.0,mubawab,175.0,Apartment to purchase in Nabeul. Surface area 175 m². Large terrace,Appart,À Vendre,Nabeul
3,620000.0,mubawab,206.0,"Apartment for sale in La Marsa. Area 206 m². Private garden, Cellar",Appart,À Vendre,La Marsa
2,470000.0,mubawab,142.0,Fabulous apartment for sale in Chotrana 1. Surface area 142 m². Double glazing and central heating,Appart,À Vendre,La Soukra
19,3600000.0,mubawab,1000.0,Sale of a lovely apartment. 19 rooms,Appart,À Vendre,Medjez El Bab
2,385000.0,mubawab,102.0,"Sale of a lovely apartment in Cité El Wafa. Small area 102 m². With Lift, Balcony",Appart,À Vendre,Nabeul
2,720000.0,mubawab,120.0,"Very nice house for sale in Les Jardins de Carthage. Dimension 120 m². Carpark, Balcony",House,À Vendre,Le Kram
3,553000.0,mubawab,135.0,"Apartment to purchase in Chotrana 1. Area 135 m². Cellar, Large terrace",Appart,À Vendre,La Soukra
2,260000.0,mubawab,125.0,Beautiful apartment for sale in Les Jardins dEl Menzah 1.2 large living areas. Terrace and garden,Appart,À Vendre,Ariana
1,195000.0,mubawab,75.0,Sale of a lovely apartment in Sidi Frej. Small area 75 m². With lift,Appart,À Vendre,La Soukra
2,230000.0,mubawab,119.0,Sale of a lovely apartment in Cité el Ghazela. 4 comfortable rooms. Secured door and central heating,Appart,À Vendre,Raoued
2,140000.0,mubawab,100.0,Apartment for sale in Ariana. 3 rooms. Central heating,Appart,À Vendre,Ariana
5,2300000.0,mubawab,500.0,Luxury Villa for sale in La Soukra. 6 rooms. Parking spaces and beautiful garden.,House,À Vendre,La Soukra
1,298000.0,mubawab,84.0,Apartment for sale in Chotrana 1. Dimension 84 m². Double glazed windows and central heating,Appart,À Vendre,La Soukra
3,850000.0,mubawab,183.0,Beautiful apartment for sale in Les Berges Du Lac 2.4 large rooms. Air conditioning system,Appart,À Vendre,La Marsa
3,355000.0,mubawab,100.0,Apartment for sale in Cité Ennasr 1.3 beautiful rooms. No Lift,Appart,À Vendre,Ariana
2,170000.0,mubawab,70.0,Fabulous apartment for sale in Sousse Ville. Area of 70 m². Reinforced door and satellite dish,Appart,À Vendre,Sousse
2,1154000.0,mubawab,141.0,"Magnificent villa for sale in Les Jardins de Carthage. 3 large rooms. Caretaker available, air conditioning system",House,À Vendre,Le Kram
3,490000.0,mubawab,160.0,Apartment for sale in Hammamet. Total area 160 m². Large terrace,Appart,À Vendre,Hammamet
2,480000.0,mubawab,130.0,Find an apartment to buy in Hammam Sousse. 2 large rooms. Lift and terrace,Appart,À Vendre,Hammam Sousse
3,1050000.0,mubawab,177.0,"Sale of a lovely apartment. 3 beautiful rooms. Secured door, Enclosed residence",Appart,À Vendre,Sousse Corniche
2,185000.0,mubawab,90.0,Sale of a lovely apartment in Hammamet Nord. Surface area 90 m²,Appart,À Vendre,Hammamet
3,400000.0,mubawab,150.0,"Fabulous villa for sale in Hammamet Sud. Large area 150 m². Large swimming pool, General air conditioning",House,À Vendre,Hammamet
3,485000.0,mubawab,225.0,"House for sale in La Marsa. Area 225 m². Green areas, Balcony",House,À Vendre,La Marsa
1,390000.0,mubawab,86.0,Apartment to purchase in Ain Zaghouan Nord. 1 lovely room. Reinforced door and central heating,Appart,À Vendre,La Marsa
2,260000.0,mubawab,100.0,"Fabulous apartment for sale in El Mourouj 6.2 rooms. Reinforced door, satellite dish",Appart,À Vendre,El Mourouj
8,1600000.0,mubawab,2400.0,Luxury villa for sale in La Soukra. 7 beautiful rooms. Garden and terrace,House,À Vendre,La Soukra
3,280000.0,mubawab,210.0,Fabulous apartment for sale. Dimension 200 m². Double glazing and reinforced door,Appart,À Vendre,Bekalta
2,180000.0,mubawab,100.0,"Beautiful apartment for sale. 4 comfortable rooms. Double glazing, Robust door",Appart,À Vendre,Bekalta
6,253000.0,mubawab,330.0,"Splendid villa for sale. 6 beautiful rooms. Soundproofing, Secured door",House,À Vendre,Bekalta
2,475000.0,mubawab,98.0,"Sell apartment in La Marsa. Total area 98 m². Caretaker available, air conditioning system",Appart,À Vendre,La Marsa
3,670000.0,mubawab,126.0,"Find an apartment to buy in La Soukra. 3 rooms. Green areas, Parking spaces for cars",Appart,À Vendre,La Soukra
2,360000.0,mubawab,115.0,"Apartment to purchase in La Soukra. 2 beautiful rooms. Caretaker available, air conditioning system",Appart,À Vendre,La Soukra
2,600000.0,mubawab,103.0,Find an apartment to buy in Les Jardins de Carthage. 3 rooms. Caretaker and air conditioning,Appart,À Vendre,Le Kram
1,250000.0,mubawab,78.0,"Apartment for sale in Aouina. Area of 78 m². No Lift, Large terrace",Appart,À Vendre,La Marsa
3,720000.0,mubawab,210.0,"High quality villa for sale in Hammamet Nord. 4 comfortable rooms. Residence with swimming pool, Air conditioning",House,À Vendre,Hammamet
2,566500.0,mubawab,80.0,Apartment for sale in El Kantaoui. 2 rooms. Garden and terrace,Appart,À Vendre,Hammam Sousse
3,1339000.0,mubawab,140.0,Apartment for sale in Hammam Sousse. Area of 140 m². Cellar,Appart,À Vendre,Hammam Sousse
2,185000.0,mubawab,100.0,House for sale. 3 comfortable rooms. Sea view and reinforced door,House,À Vendre,Barraket Essahel
