chambres,prix,source,surface,titre,type_bien,type_transaction,ville
2,210000.0,mubawab,100.0,Apartment to purchase in Cité Hedi Nouira. 2 lovely rooms. Fully equipped kitchen,Appart,À Vendre,La Soukra
5,380000.0,mubawab,195.0,Magnificent villa for sale in Megrine Coteau. 6 large rooms. Balcony.,House,À Vendre,Mégrine
1,280000.0,mubawab,50.0,Fabulous apartment for sale in Chott Meriem. Total area 50 m². Carpark and elevator.,Appart,À Vendre,Akouda
1,210000.0,mubawab,40.0,"Find an apartment to buy in Cité de la Plage. 1 lovely room. Green areas, Balcony",Appart,À Vendre,Hammam Sousse
4,3500000.0,mubawab,3500.0,House for sale in Chott Meriem. Total area 3500 m². Swimming pool.,House,À Vendre,Akouda
1,443000.0,mubawab,69.0,Sell apartment in Les Jardins de Carthage. 1 room. Oven,Appart,À Vendre,Le Kram
2,240000.0,mubawab,200.0,House for sale. Surface area 200 m². Garden and terrace,House,À Vendre,Jendouba
4,675000.0,mubawab,135.0,Fabulous apartment for sale in La Marsa. 4 beautiful rooms. Residence with security.,Appart,À Vendre,La Marsa
3,220000.0,mubawab,103.0,Very nice house for sale in Cité Ennour Jaafar. 3 lovely rooms. Basement,House,À Vendre,Raoued
3,1800000.0,mubawab,273.0,"Sell apartment in Les Jardins de Carthage. 5 comfortable rooms. Soundproofing, Secured door.",Appart,À Vendre,Le Kram
4,2166000.0,mubawab,367.0,Very nice house for sale in Les Jardins de Carthage. Small area 367 m². Large swimming pool.,House,À Vendre,Le Kram
2,260000.0,mubawab,70.0,Apartment for sale in Nabeul. 2 lovely rooms. Large swimming pool.,Appart,À Vendre,Nabeul
2,200000.0,mubawab,96.0,House for sale. 2 comfortable rooms. Large balcony.,House,À Vendre,Dar Châabane
6,1760000.0,mubawab,13500.0,"High quality house for sale. Area 13500 m². Green areas, Balcony.",House,À Vendre,Zaghouan
3,1060000.0,mubawab,244.0,Apartment for sale in Les Berges Du Lac 2. 3 beautiful rooms. Parking spaces and terrace.,Appart,À Vendre,La Marsa
2,200000.0,mubawab,113.0,Sell apartment in Montfleury. Small area 113 m². Caretaker and air conditioning,Appart,À Vendre,Tunis
2,780000.0,mubawab,620.0,"Splendid villa for sale in Hammamet Sud. 4 rooms. Property with swimming pool, Integrated air conditioning.",House,À Vendre,Hammamet
6,1020000.0,mubawab,442.0,"Luxury home for sale in Bab Bhar. 6 beautiful rooms. Green area, Balcony",House,À Vendre,Tunis
6,295000.0,mubawab,97.0,Beautiful house for sale in Ibn Sina. 6 rooms,House,À Vendre,El Kabaria
4,1070000.0,mubawab,250.0,"Beautiful apartment for sale in Chotrana 2. 6 rooms. Residence with swimming pool, Air conditioning.",Appart,À Vendre,La Soukra
4,1100000.0,mubawab,330.0,"Splendid villa for sale in La Soukra. 4 lovely rooms. Robust door, General satellite dish system.",House,À Vendre,La Soukra
4,850000.0,mubawab,450.0,House for sale in Riadh al Andalous. 4 lovely rooms.,House,À Vendre,Ariana
3,1300000.0,mubawab,372.0,Sale of a lovely apartment in Les Jardins de Carthage. 3 rooms. Beautiful terrace and garden.,Appart,À Vendre,Le Kram
3,430000.0,mubawab,156.0,Find an apartment to buy in Aouina. 3 lovely rooms. Lift and terrace,Appart,À Vendre,La Marsa
3,195000.0,mubawab,112.0,Sell apartment in Cité Hedi Nouira. 2 large rooms.,Appart,À Vendre,La Soukra
1,170000.0,mubawab,52.0,Beautiful apartment for sale in Cité Ennasr 2. 1 lovely room. Air conditioning.,Appart,À Vendre,Ariana
2,320000.0,mubawab,115.0,Fabulous apartment for sale in La Soukra. Area 115 m². Reinforced door and secured residence.,Appart,À Vendre,La Soukra
3,250000.0,mubawab,100.0,Apartment to purchase in Borj Louzir. Area 100 m². Cellar,Appart,À Vendre,La Soukra
4,980000.0,mubawab,320.0,"Home to buy in Cité des Juges. 4 rooms. Double glazed window, Central air conditioning.",House,À Vendre,La Marsa
3,480000.0,mubawab,312.0,House to buy in Ben Arous. 3 lovely rooms. Central heating and reinforced door.,House,À Vendre,Ben Arous
3,479856.0,mubawab,145.0,Luxury Villa for sale in Djerba. 5 large living areas. Fully equipped kitchen.,House,À Vendre,Djerba
1,215000.0,mubawab,75.0,Apartment for sale in Les Jardins dEl Menzah 2. 1 room.,Appart,À Vendre,Ariana
2,250000.0,mubawab,75.0,Apartment to purchase in Cité Ennasr 2. Total area 75 m². General air conditioning.,Appart,À Vendre,Ariana
1,270000.0,mubawab,69.0,Sell apartment in Hammamet. Dimension 69 m². Swimming pool.,Appart,À Vendre,Hammamet
2,410000.0,mubawab,120.0,"Apartment for sale in La Soukra. Area of 120 m². caretaker available, air conditioning system.",Appart,À Vendre,La Soukra
2,725000.0,mubawab,125.0,Apartment for sale in Les Jardins de Carthage. 2 rooms. Car park.,Appart,À Vendre,Le Kram
5,700000.0,mubawab,225.0,Apartment to purchase in La Marsa. Total area 225 m².,Appart,À Vendre,La Marsa
2,395000.0,mubawab,125.0,Sell apartment in Riadh al Andalous. 2 comfortable rooms. Central heating.,Appart,À Vendre,Ariana
3,1150000.0,mubawab,420.0,High quality villa for sale in Cité El Khalil. 3 beautiful rooms. Double glazing and central heating.,House,À Vendre,La Marsa
5,360000.0,mubawab,190.0,House for sale in Bab Jazira. 5 beautiful rooms. Equipped kitchen,House,À Vendre,Tunis
6,650000.0,mubawab,350.0,Magnificent villa for sale. 10 comfortable rooms. Well equipped kitchen.,House,À Vendre,Kélibia
5,650000.0,mubawab,250.0,Fabulous house for sale. 5 beautiful rooms. Parking spaces and garden.,House,À Vendre,Kélibia
2,80000.0,mubawab,150.0,Beautiful apartment for sale in Cité El Mourouj. 2 lovely rooms. Private garden.,Appart,À Vendre,Kalaat Landalous
4,250000.0,mubawab,210.0,"Splendid villa for sale in Cité Tarek Ibn Zied. Surface area 210 m². Gardeners, Large terrace.",House,À Vendre,Kalaat Landalous
6,470000.0,mubawab,103.0,House to buy. 6 rooms. Large balcony.,House,À Vendre,La Medina
4,4500000.0,mubawab,564.0,Apartment to purchase in Les Berges Du Lac 2. Small area 564 m². Parking spaces and terrace.,Appart,À Vendre,La Marsa
3,372400.0,mubawab,120.0,Magnificent villa for sale in Djerba. 5 large living areas. Well furnished.,House,À Vendre,Djerba
3,446500.0,mubawab,165.0,Luxury Villa for sale in Djerba. Dimension 165 m². Terrace and garden.,House,À Vendre,Djerba
3,245700.0,mubawab,850.0,"House for sale in Djerba. 6 comfortable rooms. Gardeners, Large terrace.",House,À Vendre,Djerba
4,869300.0,mubawab,270.0,"Luxury home for sale in Djerba. Large area 270 m². Green area, Balcony.",House,À Vendre,Djerba
3,420000.0,mubawab,97.0,Apartment for sale in Nabeul. 4 large rooms. Ample storage space.,Appart,À Vendre,Nabeul
4,1300000.0,mubawab,500.0,"Luxury home for sale in Cité Olympique. 4 rooms. Cellar, Large terrace.",House,À Vendre,Cité El Khadra
2,980000.0,mubawab,124.0,Apartment to purchase in La Marsa. Surface area 124 m². Double glazing and central heating.,Appart,À Vendre,La Marsa
3,1100000.0,mubawab,225.0,"Sell apartment in Les Berges Du Lac 2.4 large living areas. Double glazed window, Central air conditioning",Appart,À Vendre,La Marsa
3,850000.0,mubawab,270.0,"Fabulous house for sale in Yasmine Hammamet. 3 rooms. Residence with swimming pool, Air conditioning.",House,À Vendre,Hammamet
4,1250000.0,mubawab,630.0,"High quality house for sale in Hammamet Sud. 4 beautiful rooms. Property with swimming pool, Integrated air conditioning.",House,À Vendre,Hammamet
3,480000.0,mubawab,128.0,Sale of a lovely apartment in Bouhssina. Area 128 m². Balcony.,Appart,À Vendre,Sousse
4,1600000.0,mubawab,325.0,High quality villa for sale in Chotrana 3.6 comfortable rooms. Garden and terrace,House,À Vendre,La Soukra
4,945500.0,mubawab,350.0,High quality villa for sale in Djerba. 4 beautiful rooms. Attic.,House,À Vendre,Djerba
4,666000.0,mubawab,250.0,Very nice riad for sale in Djerba. Area 250 m². New furniture.,House,À Vendre,Djerba
3,549580.0,mubawab,198.0,"High quality house for sale in Djerba. 5 rooms. Swimming pool, air conditioning.",House,À Vendre,Djerba
3,615900.0,mubawab,200.0,High quality house for sale in Djerba. 3 beautiful rooms. Furnished.,House,À Vendre,Djerba
3,291200.0,mubawab,125.0,High quality house for sale in Djerba. 3 beautiful rooms. Air conditioning.,House,À Vendre,Djerba
3,388900.0,mubawab,139.0,Beautiful house for sale in Djerba. 3 Hall. Property with swimming pool.,House,À Vendre,Djerba
3,1075200.0,mubawab,220.0,"Find an apartment to buy in Les Berges Du Lac 2.3 lovely rooms. Carpark, Balcony",Appart,À Vendre,La Marsa
2,272300.0,mubawab,105.0,Fabulous villa for sale in Djerba. 3 large living areas. Fitted kitchen.,House,À Vendre,Djerba
4,940000.0,mubawab,275.0,"Magnificent villa for sale in Hammamet. 5 large living areas. Large swimming pool, General air conditioning.",House,À Vendre,Hammamet
3,1500000.0,mubawab,335.0,Apartment to purchase in Les Berges Du Lac 2. Total area 335 m². Garage and terrace.,Appart,À Vendre,La Marsa
3,278300.0,mubawab,135.0,"Splendid villa for sale in Djerba. 5 comfortable rooms. Robust door, General satellite dish system.",House,À Vendre,Djerba
3,276900.0,mubawab,139.0,High quality villa for sale in Djerba. Area of 139 m². Secured door.,House,À Vendre,Djerba
3,315800.0,mubawab,146.0,"Very nice house for sale in Djerba. Large area 146 m². Gardeners, Large terrace.",House,À Vendre,Djerba
3,457600.0,mubawab,139.0,Fabulous villa for sale in Djerba. Small area 139 m². New furniture.,House,À Vendre,Djerba
3,475300.0,mubawab,138.0,Fabulous villa for sale in Djerba. 5 rooms. Fully furnished.,House,À Vendre,Djerba
3,351300.0,mubawab,140.0,"Magnificent villa for sale in Djerba. 5 rooms. Green area, Balcony.",House,À Vendre,Djerba
3,680000.0,mubawab,165.0,Sale of a lovely apartment in Les Jardins de Carthage. 3 lovely rooms. New furniture,Appart,À Vendre,Le Kram
9,940000.0,mubawab,475.0,"High quality house for sale in Cité El Habib. 4 large rooms. Green areas, Balcony",House,À Vendre,Ezzahra
3,478500.0,mubawab,145.0,"High quality house for sale in Djerba. Total area 145 m². Gardeners, Large terrace.",House,À Vendre,Djerba
2,600000.0,mubawab,123.0,Sale of a lovely apartment in Les Jardins de Carthage. 2 lovely rooms. Washing machine.,Appart,À Vendre,Le Kram
4,185000.0,mubawab,120.0,Fabulous apartment for sale. 4 beautiful rooms.,Appart,À Vendre,Ariana
3,335000.0,mubawab,161.0,Sell apartment in Aouina. 3 beautiful rooms. Storage unit,Appart,À Vendre,La Marsa
4,360000.0,mubawab,140.0,Apartment for sale in Ariana. Area of 170 m². Caretaker service and air conditioning.,Appart,À Vendre,Ariana
3,400000.0,mubawab,652.0,Beautiful house for sale. Surface area 652 m². Parking spaces and terrace.,House,À Vendre,Soliman
4,1200000.0,mubawab,280.0,Luxury Villa for sale in Hammamet Nord. Surface area 280 m². Reinforced door and satellite dish.,House,À Vendre,Hammamet
4,760000.0,mubawab,284.0,Magnificent villa for sale in Hammamet. Small area 284 m². Garden and terrace.,House,À Vendre,Hammamet
2,320000.0,mubawab,84.0,"Sell apartment. 2 Dormitory. Residence with caretaker, Large swimming pool.",Appart,À Vendre,Hammamet
1,320000.0,mubawab,74.0,Sale of a lovely apartment in Hammamet Nord. Area of 74 m². caretaker and air conditioning.,Appart,À Vendre,Hammamet
5,890000.0,mubawab,330.0,"Splendid villa for sale in Hammamet Nord. 5 lovely rooms. Beautiful sea view, Double glazing.",House,À Vendre,Hammamet
4,950000.0,mubawab,300.0,Luxury Villa for sale in Hammamet. Total area 300 m². Double glazed windows and reinforced door.,House,À Vendre,Hammamet
2,560000.0,mubawab,118.0,Fabulous apartment for sale in Hammamet Nord. Dimension 118 m².,Appart,À Vendre,Hammamet
4,790000.0,mubawab,250.0,Luxury home for sale in Hammamet Nord. 4 lovely rooms. Air conditioning and swimming pool.,House,À Vendre,Hammamet
5,2400000.0,mubawab,800.0,Fabulous villa for sale in Sidi Frej. 6 Toilet. Garden and terrace.,House,À Vendre,La Soukra
3,540000.0,mubawab,180.0,High quality house for sale in Hammamet Sud. 3 beautiful rooms. Central heating and reinforced door.,House,À Vendre,Hammamet
2,380000.0,mubawab,113.0,"Sell apartment in Yasmine Hammamet. 3 comfortable rooms. caretaker available, air conditioning system.",Appart,À Vendre,Hammamet
4,780000.0,mubawab,750.0,Fabulous villa for sale in Hammamet Sud. Large area 750 m². Reinforced door and secured residence.,House,À Vendre,Hammamet
4,800000.0,mubawab,260.0,"Fabulous apartment for sale in La Soukra. Dimension 260 m². Private garden, Cellar.",Appart,À Vendre,La Soukra
1,250000.0,mubawab,80.0,"Apartment to purchase in La Marsa. Dimension 80 m². Caretaker service available, air conditioning.",Appart,À Vendre,La Marsa
4,1500000.0,mubawab,467.0,"House for sale in Les Jardins de Carthage. Surface area 467 m². Cellar, Large terrace.",House,À Vendre,Le Kram
3,120000.0,mubawab,70.0,"Find an apartment to buy in Borj Louzir. 3 beautiful rooms. Robust door, Air conditioning installation.",Appart,À Vendre,La Soukra
12,2400000.0,mubawab,980.0,House to buy in El Menzah 4. 14 rooms. Private car park.,House,À Vendre,El Menzah
2,335000.0,mubawab,80.0,House for sale in Djerba. 6 rooms. Well furnished.,House,À Vendre,Djerba
3,350000.0,mubawab,575.0,High quality villa for sale in Gabès. Total area 557 m². New furniture.,House,À Vendre,Gabès
3,750000.0,mubawab,391.0,High quality house for sale in Chotrana 2. Area of 391 m². Reinforced door and central heating.,House,À Vendre,La Soukra
3,690000.0,mubawab,390.0,Splendid villa for sale in La Soukra. 3 large rooms. Garden and garage.,House,À Vendre,La Soukra
5,1700000.0,mubawab,400.0,Luxury villa for sale in Oued Ellil. Dimension 400 m². Furnishings.,House,À Vendre,Oued Ellil
5,220000.0,mubawab,120.0,Fabulous apartment for sale in Hedi Chaker. Area of 120 m²,Appart,À Vendre,Tunis
3,550000.0,mubawab,240.0,Fabulous villa for sale. Dimension 240 m². Garage.,House,À Vendre,Dar Châabane
5,650000.0,mubawab,240.0,Fabulous house for sale. 7 rooms. Large balcony.,House,À Vendre,Dar Châabane
2,170000.0,mubawab,70.0,Apartment for sale in Montplaisir. 3 large rooms.,Appart,À Vendre,Tunis
3,1200000.0,mubawab,600.0,"Fabulous house for sale in Chotrana 3. 3 large living areas. Green area, Balcony.",House,À Vendre,La Soukra
4,600000.0,mubawab,200.0,"Sell apartment in Cité Ennasr 2. Surface area 200 m². View of the mountains, central heating",Appart,À Vendre,Ariana
3,1200000.0,mubawab,220.0,Fabulous apartment for sale in Les Berges Du Lac 2. Surface area 220 m². Cellar.,Appart,À Vendre,La Marsa
4,1500000.0,mubawab,430.0,Luxury Villa for sale in La Soukra. 4 rooms. Lift and garage.,House,À Vendre,La Soukra
4,950000.0,mubawab,310.0,High quality villa for sale in Hammamet. 5 large rooms. Garden and terrace.,House,À Vendre,Hammamet
3,200000.0,mubawab,95.0,Beautiful apartment for sale. Area of 95 m². Garage and terrace,Appart,À Vendre,Ghar El Melh
2,334490.0,mubawab,102.0,High quality villa for sale in Djerba. Area 102 m². Beautiful terrace and garden.,House,À Vendre,Djerba
4,200000.0,mubawab,125.0,Beautiful apartment for sale in Montfleury. Dimension 125 m²,Appart,À Vendre,Tunis
3,473580.0,mubawab,805.0,Luxury villa for sale in Djerba. 6 large rooms. Gardeners.,House,À Vendre,Djerba
2,220000.0,mubawab,430.0,"House for sale in Raoued. 2 large living areas. Green area, Balcony.",House,À Vendre,Raoued
3,680700.0,mubawab,195.0,Fabulous villa for sale in Djerba. Area 195 m². Air conditioning and swimming pool.,House,À Vendre,Djerba
3,550000.0,mubawab,244.0,House for sale in Hammamet. 3 beautiful rooms. Integrated air conditioning.,House,À Vendre,Hammamet
3,286000.0,mubawab,136.0,Beautiful apartment for sale in Tunis Belvedere. 3 rooms. Air conditioning and fireplace.,Appart,À Vendre,El Menzah
3,592790.0,mubawab,159.0,Luxury villa for sale in Djerba. Small area 159 m². New furniture.,House,À Vendre,Djerba
1,258000.0,mubawab,81.0,Apartment to purchase in Les Berges Du Lac 1. 1 lovely room.,Appart,À Vendre,La Marsa
3,540000.0,mubawab,167.0,Apartment for sale in Chott Meriem. 3 beautiful rooms. Swimming pool and caretaker service.,Appart,À Vendre,Akouda
3,630000.0,mubawab,120.0,Apartment for sale in Chotrana 1. Surface area 120 m². Reinforced door and central heating.,Appart,À Vendre,La Soukra
3,395300.0,mubawab,400.0,"High quality house for sale in Djerba. Large area 400 m². Gardeners, Large terrace.",House,À Vendre,Djerba
3,323800.0,mubawab,340.0,Luxury Villa for sale in Djerba. Total area 340 m². Ample storage space.,House,À Vendre,Djerba
2,542680.0,mubawab,150.0,High quality house for sale in Djerba. 4 comfortable rooms. Swimming pool and air conditioning.,House,À Vendre,Djerba
3,637400.0,mubawab,175.0,High quality house for sale in Djerba. 3 beautiful rooms. Well decorated.,House,À Vendre,Djerba
2,291800.0,mubawab,105.0,"House for sale in Djerba. Area of 105 m². Property with swimming pool, Integrated air conditioning.",House,À Vendre,Djerba
3,477200.0,mubawab,145.0,Fabulous villa for sale in Djerba. 3 lovely rooms. Garden.,House,À Vendre,Djerba
3,739070.0,mubawab,240.0,"Luxury Villa for sale in Djerba. Surface area 240 m². Superb sea view, Secured door.",House,À Vendre,Djerba
7,720000.0,mubawab,450.0,Beautiful apartment for sale. 7 rooms. Beautiful terrace.,Appart,À Vendre,Hergla
4,1100000.0,mubawab,347.0,Splendid villa for sale in Hammamet Nord. 5 rooms. Carpark and terrace.,House,À Vendre,Hammamet
4,410000.0,mubawab,465.0,Fabulous house for sale in Kalaat Landalous. 1 Room. Carpark and garden.,House,À Vendre,Kalaat Landalous
4,415000.0,mubawab,466.0,"Luxury home for sale in Kalaat Landalous. 4 rooms. Green areas, Balcony.",House,À Vendre,Kalaat Landalous
2,200000.0,mubawab,260.0,Beautiful apartment for sale in Cité Bir El Araies. 3 comfortable rooms. Glass wall.,Appart,À Vendre,Kalaat Landalous
6,480000.0,mubawab,120.0,House for sale in Cité Chaker. 2 rooms. Attic.,House,À Vendre,Raoued
2,140000.0,mubawab,65.0,Sale of a lovely apartment in El Gourjani. Dimension 65 m². Furnished,Appart,À Vendre,Tunis
3,100000.0,mubawab,70.0,Apartment to purchase in Montfleury. 3 beautiful rooms,Appart,À Vendre,Tunis
3,280000.0,mubawab,100.0,Apartment for sale in Monastir Ville. Area of 100 m². Fully equipped kitchen.,Appart,À Vendre,Monastir
5,3400000.0,mubawab,700.0,Very nice house for sale in Les Jardins de Carthage. 5 lovely rooms. Large swimming pool.,House,À Vendre,Le Kram
2,267000.0,mubawab,112.0,"Find an apartment to buy in El Mourouj 6. 2 rooms. Residence with caretaker, general air conditioning.",Appart,À Vendre,El Mourouj
6,890000.0,mubawab,605.0,"Luxury home for sale. 6 beautiful rooms. Exceptional mountain view, Soundproofing.",House,À Vendre,Soliman
3,520000.0,mubawab,230.0,Magnificent villa for sale in Ariana. 3 rooms. Garden and terrace.,House,À Vendre,Ariana
5,2700000.0,mubawab,680.0,House to buy. Dimension 680 m². Large swimming pool.,House,À Vendre,La Soukra
4,365000.0,mubawab,150.0,Beautiful apartment for sale in Les Jardins dEl Menzah 1. 4 large living areas. Central heating.,Appart,À Vendre,Ariana
3,265000.0,mubawab,113.0,Fabulous apartment for sale in Cité Ennasr 2. 3 lovely rooms.,Appart,À Vendre,Ariana
3,500000.0,mubawab,400.0,Splendid villa for sale in Bou Mhel. 3 rooms. Garden.,House,À Vendre,Boumhel Bassatine
3,450000.0,mubawab,140.0,Sell apartment in El Manar 2. Large area 140 m². Beautiful terrace.,Appart,À Vendre,El Menzah
2,650000.0,mubawab,400.0,Beautiful apartment for sale. 2 lovely rooms. Terrace and garden.,Appart,À Vendre,Kélibia
7,780000.0,mubawab,1300.0,"High quality house for sale. 9 comfortable rooms. Sea view, central heating.",House,À Vendre,El Haouaria
4,650000.0,mubawab,350.0,High quality villa for sale in Beni Khiar. 4 lovely rooms. Carpark and terrace.,House,À Vendre,Beni Khiar
1,315000.0,mubawab,139.0,Find an apartment to buy in Cité Ennasr 2. Small area 139 m². Large balcony.,Appart,À Vendre,Ariana
1,220000.0,mubawab,90.0,Find an apartment to buy in Ain Zaghouan Nord. Small area 90 m². Air conditioning system.,Appart,À Vendre,La Marsa
1,350000.0,mubawab,68.0,Fabulous apartment for sale in Ain Zaghouan Nord. Area of 68 m². Air conditioning.,Appart,À Vendre,La Marsa
2,530000.0,mubawab,111.0,Find an apartment to buy in Les Berges Du Lac 2. 2 rooms. caretaker and air conditioning.,Appart,À Vendre,La Marsa
4,380000.0,mubawab,190.0,Beautiful apartment for sale in Sousse Jaouhara. Small area 190 m². Air conditioning.,Appart,À Vendre,Sousse Jaouhara
3,680000.0,mubawab,147.0,Apartment for sale in Les Jardins de Carthage. Area of 147 m². Cellar.,Appart,À Vendre,Le Kram
3,630000.0,mubawab,230.0,House for sale in Les Jardins dEl Menzah 1. 3 large living areas. Private car park.,House,À Vendre,Ariana
4,400000.0,mubawab,120.0,Fabulous apartment for sale in Cité Ennasr 2. Surface area 120 m². Central heating.,Appart,À Vendre,Ariana
4,320000.0,mubawab,280.0,House for sale. 4 rooms. New furniture,House,À Vendre,Utique
6,250000.0,mubawab,303.0,House for sale. 6 rooms,House,À Vendre,Dar Châabane
9,900000.0,mubawab,431.0,Luxury villa for sale. Total area 431 m². Garden and garage.,House,À Vendre,Kélibia
2,50000.0,mubawab,100.0,Sale of a lovely apartment. Small area 100 m².,Appart,À Vendre,Menzel Temime
3,981700.0,mubawab,174.0,Sale of a lovely apartment in Les Jardins de Carthage. 3 lovely rooms. Double glazing and reinforced door.,Appart,À Vendre,Le Kram
1,390000.0,mubawab,75.0,Apartment for sale in Les Jardins de Carthage. Surface area 75 m². Basement.,Appart,À Vendre,Le Kram
2,685000.0,mubawab,137.0,Apartment for sale in Les Jardins de Carthage. 2 lovely rooms. Fully equipped kitchen,Appart,À Vendre,Le Kram
4,1180000.0,mubawab,514.0,High quality house for sale in Hammamet. 4 beautiful rooms. Garden and garage.,House,À Vendre,Hammamet
1,3200000.0,mubawab,1208.0,Beautiful house for sale in La Marsa. Area of 1208 m². Gardeners,House,À Vendre,La Marsa
2,280000.0,mubawab,84.0,"Apartment to purchase in Tantana. Dimension 84 m². No Lift, Large terrace.",Appart,À Vendre,Akouda
4,1150000.0,mubawab,840.0,"Fabulous villa for sale in Yasmine Hammamet. 5 large living areas. Green areas, Balcony.",House,À Vendre,Hammamet
6,1700000.0,mubawab,400.0,Magnificent villa for sale in Hammamet Sud. 6 beautiful rooms. Furnishings.,House,À Vendre,Hammamet
3,1500000.0,mubawab,680.0,Luxury Villa for sale in Hammamet Sud. 4 comfortable rooms. Beautiful terrace and garden.,House,À Vendre,Hammamet
4,940000.0,mubawab,275.0,"Luxury villa for sale in Hammamet. Large area 275 m². Property with swimming pool, Integrated air conditioning.",House,À Vendre,Hammamet
1,265000.0,mubawab,70.0,Beautiful apartment for sale in La Soukra. 2 comfortable rooms. With lift and terrace.,Appart,À Vendre,La Soukra
11,750000.0,mubawab,600.0,House for sale in Sousse Riadh. 6 large living areas. Beautiful terrace and garden,House,À Vendre,Sousse Riadh
3,500000.0,mubawab,190.0,Find an apartment to buy in Gammarth. 4 large living areas. Double glazed windows and central heating.,Appart,À Vendre,La Marsa
2,380000.0,mubawab,90.0,"Find an apartment to buy in La Soukra. 2 lovely rooms. Reinforced door, security.",Appart,À Vendre,La Soukra
3,380000.0,mubawab,535.0,House for sale in Raoued. 4 large living areas. Secured door and central heating,House,À Vendre,Raoued
3,420000.0,mubawab,136.0,Apartment for sale in La Soukra. Area of 136 m². Garage.,Appart,À Vendre,La Soukra
6,920000.0,mubawab,265.0,House for sale. 6 lovely rooms. Garden and terrace.,House,À Vendre,Cité Jaouhara
1,650000.0,mubawab,238.0,Fabulous apartment for sale in Hammam Sousse. 1 room. Air conditioning.,Appart,À Vendre,Hammam Sousse
3,330000.0,mubawab,125.0,"Apartment to purchase in Riadh al Andalous. 3 large living areas. caretaker service available, General air conditioning.",Appart,À Vendre,Ariana
2,350000.0,mubawab,133.0,Find your house to buy in Houmt Souk. Area 133 m². Storage unit.,House,À Vendre,Houmt Souk
5,980000.0,mubawab,705.0,High quality house for sale in Hammam Chatt. 5 beautiful rooms. Ample storage space,House,À Vendre,Hammam Chatt
4,1280000.0,mubawab,370.0,House to buy in Chotrana 1. 4 lovely rooms. Swimming pool.,House,À Vendre,La Soukra
2,380324.0,mubawab,112.0,Apartment to purchase. Area of 112 m². Central heating,Appart,À Vendre,El Aouina
2,408646.0,mubawab,120.0,Apartment to purchase in Aouina. Surface area 120 m². Air conditioned,Appart,À Vendre,La Marsa
3,450000.0,mubawab,125.0,Fabulous apartment for sale in Aouina. 3 lovely rooms. Lift and terrace.,Appart,À Vendre,La Marsa
3,160000.0,mubawab,121.0,"Apartment to purchase in Sidi Mansour. 4 rooms. General Satellite Dish, Secured neighbourhood.",Appart,À Vendre,Sakiet Eddaier
1,260000.0,mubawab,70.0,"Apartment for sale in Chotrana 3. Area 70 m². With Lift, Carpark.",Appart,À Vendre,La Soukra
3,310000.0,mubawab,110.0,"Fabulous apartment for sale in Sidi El Mahrsi. Area of 110 m². Satellite dish, secured residence.",Appart,À Vendre,Nabeul
2,390000.0,mubawab,80.0,"Apartment to purchase in Hammamet Nord. Small area 80 m². Residence with caretaker, general air conditioning.",Appart,À Vendre,Hammamet
3,360000.0,mubawab,110.0,Sale of a lovely apartment in Hammam Sousse. 3 large living areas.,Appart,À Vendre,Hammam Sousse
6,550000.0,mubawab,487.0,Luxury Villa for sale in Bellevue. 8 rooms. Private garage.,House,À Vendre,El Ouardia
2,326000.0,mubawab,116.0,Beautiful apartment for sale in Khezama. Area of 116 m². Fully equipped kitchen.,Appart,À Vendre,Khezama Est
2,375000.0,mubawab,111.0,Beautiful apartment for sale in Khezama. Large area 111 m². Equipped kitchen.,Appart,À Vendre,Khezama Est
3,539000.0,mubawab,143.0,Apartment for sale in Khezama. Area 143 m². Well equipped kitchen.,Appart,À Vendre,Khezama Est
5,750000.0,mubawab,554.0,"High quality house for sale in Cité el Ghazela. 3 rooms. General Satellite Dish, Secured neighbourhood.",House,À Vendre,Raoued
